<?xml version="1.0" encoding="utf-8"?>
<portal xmlns="http://schemas.sulu.io/portal/portal"
        xmlns:xsi="http://www.w3.org/2001/XMLSchema-instance"
        xsi:schemaLocation="http://schemas.sulu.io/portal/portal http://schemas.sulu.io/portal/portal-1.0.xsd">

    <name>Massive Art</name>
    <key>massiveart</key>

    <languages>
        <language main="true">en</language>
        <language fallback="true">de</language>
    </languages>

    <theme>
        <key>massiveart</key>
        <excluded>
            <template>overview</template>
        </excluded>
    </theme>

    <environments>
        <environment type="prod">
            <urls>
                <url main="true">massiveart.com</url>
                <url>www.massiveart.com</url>
            </urls>
        </environment>
        <environment type="dev">
            <urls>
                <url main="true">massiveart.lo</url>
            </urls>
        </environment>
    </environments>
</portal>
